{
  "kind": "story_card",
  "id": "elder-oni-armour-intro",
  "status": "proposed",
  "trigger": "Intro card (Y3): entering the Elder Oni elder node",
  "text": "The Elder Oni plants its club in the snow: \"Hit me mid-swing and I will finish the swing.\"",
  "placeholders": [],
  "speaker": "Elder Oni",
  "rules": [
    "S1",
    "S2",
    "Y3"
  ],
  "notes": "Voice for Oni/Kappa is a proposal (vault Characters open question): Oni proud and blunt, Kappa formal and polite."
}
