{
  "kind": "story_card",
  "id": "wake-up-nine-tails-row-5",
  "status": "proposed",
  "trigger": "Later loss: Ryo is knocked out by the Nine-Tailed Kitsune at row 5 (wake-up variant by row reached and winning yokai, S3)",
  "text": "Ryo wakes at the province's edge, his talismans blank as unwritten paper. Far off, {yokai} slips back into the bamboo, her tails swaying in the dusk, and does not look back.",
  "placeholders": [
    "yokai"
  ],
  "speaker": "narrator",
  "rules": [
    "S1",
    "S2",
    "S3",
    "S4",
    "M3"
  ],
  "notes": "Generated by tools/content_pipeline (run v1-single-query) from vault chunks: 01-vibe/Story.md#Elder intro cards; 01-vibe/Story.md#Wake-up cards; 01-vibe/Story.md#Card schedule; 01-vibe/Characters.md#Kitsune"
}
