{
  "kind": "story_card",
  "id": "nine-tails-reflect-intro",
  "status": "proposed",
  "trigger": "Intro card (Y3): entering the Nine-Tails elder node",
  "text": "Nine tails stir behind the mask, and Ryo's own reflection smiles back. \"Show me a trick once, little exorcist,\" the Nine-Tails purrs, \"and I will hand it back the second time.\"",
  "placeholders": [],
  "speaker": "Nine-Tailed Kitsune",
  "rules": [
    "S1",
    "S2",
    "Y3"
  ],
  "notes": "Voice for Oni/Kappa is a proposal (vault Characters open question): Oni proud and blunt, Kappa formal and polite."
}
