{
  "kind": "story_card",
  "id": "win-3",
  "status": "proposed",
  "trigger": "Win 3 (ending): third Tanuki victory",
  "text": "Ryo binds the Tanuki, then tears every talisman open, his own included, and the spirits drift out like lantern smoke. \"I said I'd set you free,\" he says.",
  "placeholders": [],
  "speaker": "Ryo",
  "rules": [
    "S1",
    "S2",
    "S3"
  ],
  "notes": "AM2 ending line verbatim. Pays off Master Soen's 'name the debt'."
}
