{
  "kind": "story_card",
  "id": "elder-intro-elder-kappa",
  "status": "proposed",
  "trigger": "Intro card on the Elder Kappa's map node, rows 5 and 8 (Y3)",
  "title": "Elder Kappa",
  "text": "The Elder Kappa bows by the lantern river, and once its hands close on you, nothing pulls them open, so keep your distance.",
  "speaker": "narrator",
  "rules": [
    "S1",
    "S2",
    "Y2",
    "Y3"
  ],
  "notes": "Generated by tools/content_pipeline (run v2-planned-retrieval) from vault chunks: 02-mechanics/Yokai.md#Kappa; 01-vibe/Story.md#Elder intro cards; 01-vibe/Characters.md#Kappa; 01-vibe/Tone.md#Voice: the narrator; 01-vibe/Tone.md#The tone line; 01-vibe/Tone.md#Card form"
}
