{
  "kind": "story_card",
  "id": "nine-tails-reflect-label",
  "status": "proposed",
  "trigger": "HUD label (Y3) for label_key twist.nine-tails-reflect: one line, always visible in the elder fight",
  "text": "Reflects a special used twice in a row",
  "placeholders": [],
  "speaker": "HUD",
  "rules": [
    "S1",
    "S2",
    "Y3"
  ],
  "notes": "Not a story beat; stored as a card because no label table exists yet."
}
