{
  "kind": "story_card",
  "id": "elder-intro-elder-kappa",
  "status": "proposed",
  "trigger": "Intro card on the Elder Kappa's map node, rows 5 and 8 (Y3)",
  "title": "Elder Kappa",
  "text": "The Elder Kappa's grip is unbreakable, so once its throw lands there is no escaping it, and you must avoid being grabbed at all.",
  "speaker": "narrator",
  "rules": [
    "S1",
    "S2",
    "Y2",
    "Y3"
  ],
  "notes": "Generated by tools/content_pipeline (run v1-single-query) from vault chunks: 01-vibe/Story.md#Elder intro cards; 01-vibe/Art-and-Audio.md#Elder twists on screen; 02-mechanics/Yokai.md#Elders; 02-mechanics/Yokai.md#Oni"
}
