{
  "kind": "story_card",
  "id": "wake-up-oni-early",
  "status": "proposed",
  "trigger": "Later loss: Ryo is knocked out by the Oni at row 2 or 3 (wake-up variant by row reached and winning yokai, S3)",
  "text": "Ryo wakes at the province's edge, every talisman blank. Whatever {yokai} wanted, it has already gone back to its own business, leaving him only the dust and the walk back.",
  "placeholders": [
    "yokai"
  ],
  "speaker": "narrator",
  "rules": [
    "S1",
    "S2",
    "S3",
    "S4",
    "M3"
  ],
  "notes": "Generated by tools/content_pipeline (run v1-single-query) from vault chunks: 01-vibe/Story.md#Wake-up cards; 01-vibe/Story.md#Card schedule; 01-vibe/Story.md#Elder intro cards; 02-mechanics/Run-Loop.md#The map"
}
