{
  "kind": "story_card",
  "id": "elder-intro-nine-tailed-kitsune",
  "status": "proposed",
  "trigger": "Intro card on the Nine-Tailed Kitsune's map node, rows 5 and 8 (Y3)",
  "title": "Nine-Tailed Kitsune",
  "text": "Nine tails sway in the dusk; show her the same trick twice running and she hands it back to you as foxfire.",
  "speaker": "narrator",
  "rules": [
    "S1",
    "S2",
    "Y2",
    "Y3"
  ],
  "notes": "Generated by tools/content_pipeline (run v2-planned-retrieval) from vault chunks: 02-mechanics/Yokai.md#Kitsune; 01-vibe/Story.md#Elder intro cards; 01-vibe/Characters.md#Kitsune; 01-vibe/Tone.md#Voice: the narrator; 01-vibe/Tone.md#The tone line; 01-vibe/Tone.md#Card form"
}
