{
  "kind": "story_card",
  "id": "wake-up-oni-early",
  "status": "proposed",
  "trigger": "Later loss: Ryo is knocked out by the Oni at row 2 or 3 (wake-up variant by row reached and winning yokai, S3)",
  "text": "{yokai} shoulders its iron club and heads back toward the snowy shrine gate without a word. You wake at the province's edge, and every talisman is blank.",
  "placeholders": [
    "yokai"
  ],
  "speaker": "narrator",
  "rules": [
    "S1",
    "S2",
    "S3",
    "S4",
    "M3"
  ],
  "notes": "Generated by tools/content_pipeline (run whole-notes): written by habit-writer from vault notes 01-vibe/Tone.md; 01-vibe/Story.md; 01-vibe/Characters.md; 02-mechanics/Yokai.md; checked by rules-lawyer"
}
