{
  "kind": "story_card",
  "id": "wake-up-oni-early",
  "status": "proposed",
  "trigger": "Later loss: Ryo is knocked out by the Oni at row 2 or 3 (wake-up variant by row reached and winning yokai, S3)",
  "text": "You wake at the province's edge, every talisman blank as new paper. Far off, {yokai} trudges back to its snowy shrine gate, as if the duel were a chore finished and nothing more.",
  "placeholders": [
    "yokai"
  ],
  "speaker": "narrator",
  "rules": [
    "S1",
    "S2",
    "S3",
    "S4",
    "M3"
  ],
  "notes": "Generated by tools/content_pipeline (run v2-planned-retrieval) from vault chunks: 01-vibe/Story.md#Wake-up cards; 01-vibe/Story.md#The illusion loop; 01-vibe/Story.md#Talismans; 01-vibe/Characters.md#Oni; 01-vibe/Tone.md#Voice: the narrator; 01-vibe/Tone.md#The tone line; 01-vibe/Tone.md#Card form; 01-vibe/Tone.md#Do and don't examples"
}
