{
  "kind": "story_card",
  "id": "elder-intro-elder-kappa",
  "status": "proposed",
  "trigger": "Intro card on the Elder Kappa's map node, rows 5 and 8 (Y3)",
  "title": "Elder Kappa",
  "text": "The Elder Kappa bows politely at the lantern riverbank, and once its hands close on you, no struggle will pry them loose.",
  "speaker": "narrator",
  "rules": [
    "S1",
    "S2",
    "Y2",
    "Y3"
  ],
  "notes": "Generated by tools/content_pipeline (run whole-notes): written by habit-writer from vault notes 01-vibe/Tone.md; 01-vibe/Story.md; 01-vibe/Characters.md; 02-mechanics/Yokai.md; checked by rules-lawyer"
}
