{
  "kind": "story_card",
  "id": "wake-up-kappa-row-6",
  "status": "proposed",
  "trigger": "Later loss: Ryo is knocked out by the Kappa at row 6 (wake-up variant by row reached and winning yokai, S3)",
  "text": "{yokai} bows politely, spilling a little water from its dish, and goes back to the lantern riverbank. Ryo wakes at the province's edge, and one paper talisman still bears a faint stroke of ink.",
  "placeholders": [
    "yokai"
  ],
  "speaker": "narrator",
  "rules": [
    "S1",
    "S2",
    "S3",
    "S4",
    "M3"
  ],
  "notes": "Generated by tools/content_pipeline (run whole-notes): written by habit-writer from vault notes 01-vibe/Tone.md; 01-vibe/Story.md; 01-vibe/Characters.md; 02-mechanics/Yokai.md; checked by rules-lawyer"
}
