{
  "kind": "story_card",
  "id": "binding-line",
  "status": "final",
  "trigger": "every binding (after a yokai is beaten and its move taken)",
  "text": "Forgive me, {yokai}. I'll give it back.",
  "placeholders": ["yokai"],
  "speaker": "Ryo",
  "rules": ["S1", "S3", "S4"],
  "notes": "Verbatim per S3. Demo: yokai = Kitsune."
}
