{
  "kind": "story_card",
  "id": "elder-kappa-unbreakable-throws-label",
  "status": "proposed",
  "trigger": "HUD label (Y3) for label_key twist.elder-kappa-unbreakable-throws: one line, always visible in the elder fight",
  "text": "Its throws can't be broken",
  "placeholders": [],
  "speaker": "HUD",
  "rules": [
    "S1",
    "S2",
    "Y3"
  ],
  "notes": "Not a story beat; stored as a card because no label table exists yet."
}
